pid,name,first,middle,last,interviewed_by,interview_date,interview_city,interview_country,title,Biography Blurb,Q_1,A_1a,A_1b,A_1c,A_1d,A_1e,Q_2,A_2a,A_2b,A_2c,A_2d,A_2e,A_2f,Q_3,A_3a,A_3b,3c,Q_4,A_4a,A_4b,A_4c,A_4d,A_4e,A_4f,A_4g,Q_5,A_5a,A_5b,A_5c,A_5d,Q_6,A_6a,A_6b,A_6c,A_6d,A_6e,A_6f,Q_7,A_7a,A_7b,A_7b,Q_8,A_8a,A_8b,A_8c,Q_9,A_9a,A_9b,A_9c,A_9e,A_9f,Q_10,A_10a,A_10b,Q_11,A_11a,A_11b,A_11c,A_11d,Q_12,A_12a,A_12b,A_12c,A_12d,Q_13,A_13a,A_13b,A_13c,Q_14,A_14a,A_14b,Q_15,A_15a,A_15b,Q_16,A_16a,A_16b,A_16c,Q_17,A_17a,A_17b,A_17c,Q_18,A_18a,A_18b,Q_19,A_19a,A_19b,Q_20,A_20a,A_20b,Q_21,A_21a,A_21b,A_21c,A_21d,A_21e,Q_22,A_22a,A_22b,Q_23,A_23a,A_23b,Q_24,A_24a,Q_25,A_25a,A_25b
n01,Christiana B. Massally,Christiana,B,Massally,Jennifer Dohrn,12-Aug-19,Freetown,Sierra Leone,"Registrar, Sierra Leone Nurses and Midwives Board","Christiana Massally serves as the Registrar of the Sierra Leone Nurses and Midwives Board. During the Ebola outbreak, Massally was the Principal Public Health Sister for Western Area (the Freetown Peninsula), a position she held from 2010. Prior to that, Massally worked as a Head Sister in the Pujehun District.",Q: How did you first learn about Ebola? Can you tell me how you first even knew what it was?,"CM: It was May 23 when we heard that Ebola had struck Kailahun. There was a case in Kailahun, and people have started dying. We thought this was far away from us. But my friend, a public health doctor, used to joke “Sister, get ready, because if Ebola struck Freetown, you would be overwhelmed.” I said, “Doctor, it will not reach here. It is far away in Kailahun. This will not come to Freetown.” Little did we know that people were moving. No movement was restricted. So, alas, a case came into Freetown.",,,,,Q: Do you remember the first person you actually saw that was—do you remember that? Can you tell me about that?,"CM: We had one affected CHO in Waterloo. He died on October 12, 2014. I feel guilty. One Sunday after work, I went home. Just as I was about to go to bed, he called me, and said, “Sister, I am not well.” ","So I asked him. I said, “Joshua, what is wrong with you?” He said, “Sister, I think this is part of the big sickness.” And I said, “No, no, no, Joshua. It can’t be that. Maybe you are suffering from malaria.” ","“When I am suffering from malaria, you used to treat me.” ","“Let me explain what medicine you should take.” That was Sunday night. I told him what to do. On Monday and Tuesday, he was being harassed by some political people in Waterloo. He was taken to a cell. By Wednesday, when Concern was having training for CHOs, all the CHOs went on strike in Waterloo to help Joshua. You know what happened? Thursday morning, I went to work, and I was told that Joshua had Ebola. ",We took Joshua. We brought him to Connaught Hospital. They tested him. He was positive. They took him to the treatment center in Jui. That was where he died. He was a community health officer. He was in charge of Luawa. ,"That’s a senior community health officer who was in charge of Luawa, sensitizing people, raising their awareness, what they should do and what they should not do, as far as Ebola is concerned. He died. ","Q: How did your family—what did they go through, watching you?","CM: When I come home every evening, I bathe outside. I put everything in a new plastic bag. Nobody will touch it. I put everything in a new plastic bag. I leave my boots in my office. I will not bring these home. I leave everything outside when I come home from work and I bathe outside. I would not allow my kids to touch me. Thank God they were grown up. They were all at Komas when they saw this, so they know how to prevent themselves. My husband would pray to God for me every morning. ",,,"Q: So when the country was declared Ebola-free, what were the consequences for nurses to recover from this trauma, for the effect on the healthcare system?","CM: We lost so many nurses. So we had—it was not just the responsibility of the director of nursing to post other nurses to those places where we lost those health workers. The nurses, they felt a little bit frustrated, because with all the work that we did, we were not really recognized as people that have worked. We were not recognized. ","It’s the nurses that—we render nursing care. A doctor will not render nursing care, but a nurse. No other health worker will render nursing care. It is only, solely nursing care. And so many of them died. At times, I want to shout, to say, “Oh, God, we’ve gone through the war, we’ve gone through this Ebola, we’ve gone through this mudslide.” I am losing my temper very quickly. ","It was not an easy task for us. It wasn’t easy because there was too much to do. It would take me days, and I would be here for the whole day and night without any sleep. Thank God I worked at the intensive care unit, so I’ve been used to working like that. ",I think nurses need to be recognized. We need to be recognized. We played an important role as far as Ebola is concerned. We played our own part as nurses. ,"We would have loved to hear from all the districts, “Sister, how is it?” For what we went through, it was not an easy task for us. But we consider ourselves, and we have continued to serve the nation, because this is our country. It was not easy. It was not easy. ",,,,,,,,,,,,,,,,,,,,,,,,,,,,,,,,,,,,,,,,,,,,,A_13c,,,,,,,,,,,,,,,,,,,,,,,,,,,,,,,,,,,,,,,,
n02,Darboi G. Korkoyah,Darboi,G.,Korkoyah,Annette Mwansa Nkowane,15-Aug-19,Monrovia,Liberia,"Monitoring and Evaluation Director, Liberian Board for Nursing and Midwifery","Darboi Korkoyah, a Registered Nurse and graduate of the Tubman National Institute of Medical Arts, is the Director of Monitoring and Evaluation of the Liberian Board for Nursing and Midwifery. Previously, Korkoyah has worked with Médecins Sans Frontières, at ELWA Hospital and at John F. Kennedy Medical Center in Monrovia. Korkoyah is a nurse educator who has taught at numerous institutions including United Methodist University and the Esther Bacon School of Nursing and Midwifery.",Q: So how did you get involved?,"DGK: I got involved through the Ministry of Health in the Liberian Board for Nursing & Midwifery. We were contacted that Ebola is on the rampage. What can we do as regulators? My boss, Miss Cecelia Morris said we are educated nurses, and to practice and train the midwives and other nurses. The quality of care could prevent Ebola. The World Health Organization assigned us to be trainers during Ebola.  After that training, we were able to roll down the training to nurses and midwives in the fifteen counties in Liberia.",,,,,Q: What were you using to train?  What guidance were you basing your training on?,"DGK: We were basing our training specifically on IPC, infection prevention and control. So we taught on PPE [personal protective equipment]. We taught on how to fix [phonetic] chlorine solution, how to disinfect the infected material or equipment and supply that were being used by nurses, how to get rid of contaminated material. Those were training that were provided for our nurses, basically, especially for midwivesfe. The enhanced PPE: when you are going into the delivery ward, you need to dress in your complete, enhanced PPE in order to face your client. And they were trained that when there is no PPE you should not take the risk. You have to protect yourself before protecting another person during the Ebola, because you cannot expose yourself. If you expose yourself, you wouldn’t be able to provide the care to the client.","Ebola was very devastating. Nurses died [phonetic]. You could see people were leaving from here, going home, dead bodies upon dead bodies. Dead bodies. And nurses were not given dignified burial.",,,,,Q: What do you mean?,"DGK: They are buried there in a mass grave, whereas doctors were given specific preference to be buried to where their relative can identify their grave. But it was not done in nurses’ case.",,,"Q: So what you are saying is that doctors were buried in single graves, while nurses were put in mass—","DGK: Some doctors were buried in single graves, while nurses were buried in a mass grave.",,,,,,,Q: Did you witness any of those burials?,"DGK: No. But no matter what, we look together as a team to keep the profession moving. They say, “Keep safe, keep saving. Keep safe and keep saving.” The dead are already gone. Ebola has two symptoms: the dry symptoms and the wet symptoms. So once you die, they spray you with chlorine, so you don’t come in contact with the fluid. Today, some people cannot even identify their loved ones’ graves.",,,,"Q: So how was that, dealing with that in the family?","DGK: Oh, it was very bad. Families grieve. Families cry. Korto even called me many for many days.  With my nursing background, I said, “No, Korto, that’s the aftermath of the Ebola. It can even get you blind. It gets you confused. But with time, you will heal.” ",,,,,,Q: And what do you think of the old habits that have gone and the new policies that have been adapted since Ebola?,"DGK: During the outbreak, policies were not available. Policies were not given to nurses. They did not know where to go, how to channel their grievances. But now, at certain level, policies are there. The IPC policy, I participated in the dissemination that was helped by WHO. Or the policy is there, but are there monitoring systems? No. Now, if we just leave from here to go to one health facility, you will see there will be handwashing bucket but no water, no soap. Are we going back to the same old thing? We will get back there. If there is a monitoring system in place, quality assurance, people ensuring that handwashing, IPC policies are being implemented, I think the spread of infection will reduce to a greater extent. Ebola opened our eyes. It taught us how to take care of ourselves, how to encounter strangers, how to deal with people. It provided a vast opportunity to just read and be enlightened with new knowledge and skills. ",,,,,,,,,,,,,,,,,,,,,,,,,,,,,,,,,,,,,,,,,,,,,,,,,,,,,,,,,,,,,,,,,,,,,
n03,Dolphine Buoga,Dolphine,,Buoga,Jennifer Dohrn,12-Aug-19,Freetown,Sierra Leone,"Nursing and Midwifery Services Education Manager, ICAP Sierra Leone","Dolphine Buoga is the Nursing and Midwifery Services Education Manager for ICAP Sierra Leone, a position she has held since 2017. Buoga, originally from Kenya, came to Sierra Leone in 2014 with the International Rescue Committee and worked during the Ebola crisis in an isolation unit. Buoga holds a BA in nursing and a masters in public health with a focus on epidemiology.",Q: What is your country of origin?,"DB:  I’m a Kenyan and I’m a nurse/midwife. I have a Bachelor’s degree in nursing, and a Master’s of public health, epidemiology. That’s the sequence that made me come to Sierra Leone.",,,,,Q: Why did you become a nurse?,"DB: I grew up in a village. My family was poor, and, of course, poverty comes with a lot of childhood illnesses. Most of the time my mother could take us to the nearest dispensary. Unfortunately, my younger sister was born with cerebral palsy, and cerebral palsy has a lot of medical issues. One day you are stable; one day you’re not. I would accompany my mother to the hospital because as children living in poverty we were often falling ill. ","One of the nurses was very neat, very clean, with nice, combed hair. She wore a white dress, was very organized, and gave us the best treatment. She also gave us clean water. Basically, I admired her lifestyle and the way she used to handle us. I used to tell my mother, “One day I want to be like this lady.” She was not actually a nurse. At the village level, there were nursing aides at the village level, paramedics, but that’s what inspired me to enter the medical profession.  ",,,,,Q: When did you first hear of Ebola?,"DB: I actually studied Ebola when I was at the university, and hemorrhagic viral diseases. It was just one of the diseases, something that we had heard about; that it had occurred in Kenya and in DRC [Democratic Republic of Congo], Congo, Uganda. The outbreak in 2014 made me see it in a real life situation. ",,,"Q: Tell me a little bit about when you came to Sierra Leone to work with ICAP here, what the state of the Ebola outbreak was.","DB: In 2014, I was working for CDC [Centers for Disease Control] Nairobi. One day, when I opened my computer I saw jobs popping up. I thought, ah, these are things I’m qualified for on a website with International Rescue Committee. I sent my CV [curriculum vitae] immediately, and within three hours they got back to me. They said okay and quickly organized for an interview. I told them I’d been working with CDC on various projects: sentinel surveillance, infection prevention and control, amongst other projects, and with HIV [human immunodeficiency virus]. ","I was interviewed, and then after twenty minutes they sent me an email saying that I was successful. It was so rapid! I informed my family, there was a lot of resistance, but now that’s history.","People were being trained for three days; me, I got trained for six hours, because I already understood the concepts. The following day I went to Bo. The situation there was pathetic. Very few health personnel. People were dying, an ambulance could come with eight suspected cases. ","I was in an isolation unit, where you get the people from the community. It was like a holding unit. You first do first aid treatment. You take the sample results. You take them for testing. It would take seventy-two hours before the test results came out. We would do the conservative treatments, hydration, antipyretics, antimalarials. We were giving ciprofloxacin, quantum, ORS [oral rehydration solution], normal saline, all these things, as we waited for the results. The assignment I was given was to train nurses how to don and doff, but at times I was also engaged in patient care in the isolation unit. ","Once we confirmed a case as Ebola, we transferred the patient to the treatment center. But it was also an interesting experience because you saw human beings dying like houseflies. It was actually the first time I ever saw somebody bleeding from the eyes, the skin. You see, it was like a movie, because these are things you read about in the books, and you don’t imagine they can occur in human beings. And I saw them in real life.",,,Q: Can you talk about the relationship between nurses and the community during the rising part of Ebola?,"DB: Basically, there was this myth that it was the responsibility of the nurses, that the nurses were infecting people in the community. They became victims of circumstance. At some point it reduced, because people understood what Ebola was. Remember, this was something that rapidly came into the country, killing people en masse, and the deaths were so sudden. You know, usually there are a lot of myths when certain disasters come into the country. People come with a lot of theories to explain the cause. ",,,,"Q: Would you describe in your own development, and then certainly the work forced on Ebola here, and IPC, the role of gender, of women. Do you see any particular connection, or reasons of how we draw our own strength?","DB: Yes, sure. Actually, women are resilient. It doesn’t matter what comes their way, they always stand on their feet. We are also responsible. You see, as a woman, you know the physiology of labor, what you go through and the process of childbearing, unlike men. ","Okay? I’m not being a female chauvinist, but that is what makes us different, anyway. But yes, women played an important role, actually taking care of the children in the isolation unit. And basically, most of the people being deployed were women, because they were the nurses. We also had male nurses, but very few. Being a woman, you are professional, you are resilient, and you have what it takes to ensure somebody gets his life back and is comfortable. ",,,,,"Q: Is there anything, just from your own observations, that you would recommend? Lessons you learned from Ebola? Anything else that’s particularly focused on nursing?","DB: I would prefer the leadership of the country to take some affirmative action, because basically—I won’t say indiscipline, but there’s a lot of impunity in this country. People do things, and they walk away with it. Because, like in my country, you know you are conducting delivery. What are you supposed to have? Why don’t you put it—? That alone is for you to be punished, because you know once you get an infection chances are highly likely you will infect the other staff. Okay? And, again, on the national grid, if you are sick you will be admitted, and you are now costing economically. You are costing the government. How much money will be spent on you when you are sick? Less workforce, because when you are off there is nobody to replace you. We need to have some affirmative action and discipline. If you make a mistake, at least you need to be corrected for whatever you’ve done. We give hand sanitizer. Some of them carry it home. You are given cleaning materials; you don’t clean properly or use the materials for cleaning. A lot of shortcuts. ",,,,,,,,,,,,,,,,,,,,,,,,,,,,,,,,,,,,,,,,,,,,,,,,,,,,,,,,,,,,,,,,,,,,,
n04,Elizabeth K. Lemor,Elizabeth,K,Lemor,Annette Mwansa Nkowane,12-Aug-19,Freetown,Sierra Leone,"Nurse Midwife; Directorate of Training, Human Resources Department, Sierra Leone Ministry of Health","Elizabeth Lemor has worked as a nurse midwife since 1990. During the Ebola epidemic, Lemor worked for the Sierra Leone Ministry of Health in the Human Resource Department of the Attendance Monitoring Bureau. Previously, Lemor had worked at Ola During Children's Hospital and Kenema Government Hospital.",Q: Where were you working during the Ebola crisis? How did you become a nurse?,"EKL: I was working for the Human Resource Department at the Attendance Monitoring Unit, Bureau Unit. A friend told me that there was a school offering nursing school almost for free and would also give you lodging. I enrolled to do SRN [State Registered Nurse] in 1987. When I graduated in 1989, I was posted to the Ola During Children’s Hospital, and I went for midwifery training. ","After the midwifery, I was reposted to Children’s Hospital, and I brought my son to be with me. We relocated to Kenema, and that was when the Rebel War became intensified around the surroundings of Kenema and even in Kenema. By then, life was not really easy. Seeing the people displaced that came back. All my mother’s family members were staying with us in the same house, so the meager resources we were getting were not enough to take care of the people around us. We had to make do with whatever was available. ","I was working in Kenema Government Hospital and was assigned to one of the wards that the wounded soldiers were admitted to. It was really stressful because every day they would bring somebody that had been injured, or somebody that had been killed in the war.",,,"Q: When did you learn about Ebola, and what was your experience?","EKL: I think Ebola came in March 2013 or so, and I went on a monitoring tour in Kenema. That was when I heard that a fever was killing people in Kailahun, and we thought it was Lhasa, it will pass. When I came back to Freetown, I heard the news that it wasn’t Lhasa, it was Ebola. But before it was declared Ebola, we gave it all sorts of names. We knew the Ministry was preparing for some kind of epidemic. But health workers were thinking, it’s fever, it’s headache, and other complications of malaria, so maybe it’s malaria. Nobody thought it was its own thing. ","The first case came from Kailahun to Kenema, where many health workers had been infected and some had died. In Kenema, I got involved with Ebola when one of the health workers came to the office for an inter-district transfer. He wanted an annual leave, because he thought it was time. I told him, “You know, they say it’s Ebola, so can you please stand off my table so that we can talk? You don’t need to be so close to me.” And he said, “Sister, I’m not from where the Ebola is.” I said, “I know, but we have to start to keep precaution and other things.”","He laughed and left for Cameroon. Then the message came that they were looking for him, that he was one of the suspects they are looking for. He was captured in Cameroon and taken back to Kenema, into the ETU [Ebola Treatment Unit]. We had been thinking that Ebola was far off. Then we knew that Ebola could easily come to Freetown. ","The news about colleagues falling down with Ebola, getting ill, came. Many nurses had died. Even in Kenema, the population was rejecting health workers because they were thought to be lying. They were accused of saying “it’s Ebola,” but when people came for treatment, they would inject them and make them die. The health workers started leaving the workplace because of the stigmas and everything attached to them. ",,,"Q: What was the proudest thing you did? You know, if you look back and say, oh, but even in this confusion I did something.","EKL: The proudest thing I did was participating in the training. When we were developing the models for treatment, people from WHO would insist that we not touch the patient, that you should keep an arm’s-length distance between you and the patient. I said, “Then why are we bringing them into hospitals? Because if we are not going to touch them and we are protecting ourselves, the one thing that is always critical in nursing care is that in nursing you touch. We should devise a way so that even if you touch you are protected.” ","There is no human who is going to come close to the other who will not touch, and we had the culture of touching. That was how we changed most of the protocols to adapt to our cultural settings, where at least you will not go and see a patient struggling and not help. At least you will take water and give it to the person to drink, and not leave the person to say, “Get up and take water,” because if you are really sick you will not even get up to take water.  With us there was someone who would take it and give it to you to drink.","We had to cry out for nurses to say, “Listen, this is not right. Even the protective gear isn’t enough.” They were listening to me, to us, even during the lockdown. We participated in the lockdown, we visited people and assisted. Those are the things we are proud of that we did as a country. At least we joined hands to fight Ebola.","Q: So what can you tell us in terms of what you’ve experienced? What lessons have you learned, and what advice can you give if there’s another outbreak? How do you think we should be ready for that?","EKL: We need to strengthen the health system, but even the strengthening that Sierra Leone did was not enough, because when you strengthen the health system, for most of our colleagues or most of us working,…we don’t have the equipment and the facility to work in. And working in this part of the country as a nurse is the most deplorable [phonetic] profession in healthcare that you can go into, because nursing can be the least recognized profession in healthcare in Sierra Leone now.",,,,,,,,,,,,,,,,,,,,,,,,,,,,,,,,,,,,,,,,,,,,,,,,,,,,,,,,,,,,,,,,,,,,,,,,,,,,,,,,,,,,,,,,,
