pid,name,first,middle,last,interviewed_by,interview_date,interview_city,interview_country,title,Biography Blurb,Q_1,A_1a,A_1b,A_1c,A_1d,A_1e,Q_2,A_2a,A_2b,A_2c,A_2d,A_2e,A_2f,Q_3,A_3a,A_3b,3c,Q_4,A_4a,A_4b,A_4c,A_4d,A_4e,A_4f,A_4g,Q_5,A_5a,A_5b,A_5c,A_5d,Q_6,A_6a,A_6b,A_6c,A_6d,A_6e,A_6f,Q_7,A_7a,A_7b,A_7b,Q_8,A_8a,A_8b,A_8c,Q_9,A_9a,A_9b,A_9c,A_9e,A_9f,Q_10,A_10a,A_10b,Q_11,A_11a,A_11b,A_11c,A_11d,Q_12,A_12a,A_12b,A_12c,A_12d,Q_13,A_13a,A_13b,A_13c,Q_14,A_14a,A_14b,Q_15,A_15a,A_15b,Q_16,A_16a,A_16b,A_16c,Q_17,A_17a,A_17b,A_17c,Q_18,A_18a,A_18b,Q_19,A_19a,A_19b,Q_20,A_20a,A_20b,Q_21,A_21a,A_21b,A_21c,A_21d,A_21e,Q_22,A_22a,A_22b,Q_23,A_23a,A_23b,Q_24,A_24a,Q_25,A_25a,A_25b
n14,Annette Mwansa Nkowane,Annette,Mwansa,Knowane,Jennifer Dohrn,16-Aug-19,Monrovia,Liberia,"Former Technical Officer of Nursing and Midwifery, WHO Human Resources for Health","Annette Mwansa Nkowane is a nurse midwife from Zambia. During the Ebola outbreak, Nkowane served as the Technical Officer of Nursing and Midwifery in the World Health Organization's Health Workforce Department. Previously, she worked with other WHO departments including Mental Health and Substance Dependence and Gender and Women's Health. Nkowane trained as a community health nurse before completing a masters in human resource development. Prior to her position at the WHO, Nkowane worked with International Federation of the Red Cross on developing community-based first aid. As part of Columbia University's On the Frontlines project, Nkowane conducted interviews with Ebola nurses in Sierra Leone and Liberia in August 2019.","Q: Will you tell me your name and what job you’ve held around nursing, your orientation?","AMN: I am Zambian. I’m a nurse, a midwife as well a community health nurse. After I qualified as a registered nurse in Zambia, I worked in Zambia at different levels, at the provincial level, community and district levels. I was involved in communities a lot, working with the traditional birth attendants, community health workers.  Later, I was able to sit for the State Board exams and started working as a registered nurse in the state of Georgia and later in the state of Illinois.","Once I got my degree in Nursing, I joined my husband Dr. Nkowane who had been offered a job in Geneva with the World Health Organization, to start an AIDS program, because in the ’80s, HIV infections were beginning to take hold.",,,,Q: I would like to ask you to tell me when you first heard about Ebola.,"AMN: I can’t remember exactly which year, but when it first happened in Uganda.  By November 2014, it became apparent that this was not going anywhere.  I was attached to the Ebola Technical group.  We mobilized nurses to participate in the Ebola response, because WHO really cannot employ so many people, we rely on our partners.  There were no standards at that time. For example, one cannot just say a nurse should spend five minutes with an Ebola patient. More details are needed to offer the best option such as, where is this patient located? Has he or she just been admitted, or are they under treatment? How long does it take for a nurse to put on the PPE? All those things had to be taken into consideration.  And I think the first even statement by WHO was in August, and it was already then shocking everyone.","I think the nursing and midwifery leadership, had certain expectations, and did not understand WHO. WHO is not a lobbyist organization; it’s a technical organization. As a technical officer—the focus is on improving nursing and midwifery services in all health disciplines and not to act as lobbyist for the nursing and midwifery profession only. Because of this misconception, the nursing and midwifery community would feel that there was nothing being done in WHO, while inside WHO it was clear what was being done on nursing and midwifery. It is important that the nursing and midwifery leaders understand how WHO functions. In that way all could work better to improve the nursing and midwifery profession as a whole. For example, instead of pushing for one nurse in the organization they would encourage more nurses and midwives to join WHO in all its priority programs such as malaria and TB and all that. Then they would have a better chance of influencing health strategies and policies affecting nursing and midwifery. One person cannot do it by themselves. That’s what I think.",,,,,"Q: So here you are, five years later, actually in two countries, talking to nurses and midwives at all levels, from Ministry of Health to nurses in the Ebola treatment unit. What have you been thinking about and reflecting on? ","AMN: You know, nursing is a hands-on profession, and you never lose it, and somehow, even when I was in Geneva I was thinking, oh, I miss holding a baby, or I miss being at the bedside. But, of course, the roles evolve as you progress in your professional life. This opportunity here for me is like being closer to what I began to do as a nurse, being in touch with people, because in nursing, you have to be a people person. And really relating to people on common ground, and listening to what they go through, it’s really very emotional for me, it’s like going full circle, [laughs] as you are saying. Now we are back on the ground. Let’s see what we can do to help nurses, with that knowledge. When I’m talking to nurses and nurse leaders, I’m hearing them talking about protocols, those protocols we developed in Geneva, that they were being used, they were so helpful for them.","But I also feel sad because protocols only do not help much. It’s really how nurses respond, in terms of the support they get. Protocols will not heal the emotional wounds.  How do we make sure that, nurses on the frontline come out with less scars and continue serving? I see the emotions in the nurses we are talking to. They are willing to continue to serve as nurses, but are we supporting them enough for them to continue doing their work effectively? That is a question that I have to answer, and see how else we can mobilize resources in terms of support, as well as from their own governments to continue supporting them.",,"Q: So what have you identified as some major challenges, and what would you want to do next? ","AMN: There is need to look at individual nurses as persons, as individuals, because they have emotions, they have families. For us to keep them motivated, what policies can be put in place that really address their personal aspects? For example, we have to look at how they were working. Some of them worked so hard, they never rested. What policies can be put in place to ensure that they have some rest? They never saw their families. Is there a way that they can continue being in touch with their families? They shed tears, when they talk about having to be away from their families. Some of them had small children, like two to four years old. They never saw them in a long time. That is traumatic for a mother, not to be with their child. How else can our governments and organizations help to ensure such family interaction happen, while even controlling the risk of infection? At a personal level, there has to be something that really heals the wounds, or helps them to keep in touch with their families so that they are less stressed, less worried about what is happening at home. Although personal protection from infection succeeded, it’s that emotional part that needs to be resolved through appropriate policies and support.","There is also the issue of management.  Most of these nurses were really running the Ebola units. Management skills comes with a lot of aspects: issues of communication; conflict management; role definitions; assertiveness; being a leader. A program that addresses leadership skills, leadership and management skills for nurses would be important. Training shouldn’t happen once or as a one-off thing, it should be embedded in an in-service program with nurses enrolled from various levels. We always think that management and leadership is only necessary at a higher level. It’s not only at higher level; it should be at every level of nursing to some extent. ","Information gathering on Ebola is also very important. Nurses are supposed to record accurately, get information, relate it to others so that they know what is happening and how to respond. People say, “Oh, it’s research. It should not be for nurses.”  But when a nurse sees something at the center, if it is recorded and reported quickly, cases of Ebola would be identified earlier. So these aspects in the training curriculum should be strengthened. ","Lastly there are issues of advocacy, to sustain the momentum, especially with government. The Ebola outbreak took place, they resolved it, they moved on. But nurses and leaders in nursing associations, in the government institutions can continue with the advocacy at that level, to keep the momentum and remind populations that Ebola outbreak can happen again. They should make sure that disaster preparedness is instituted. If they can work on that, then they will be better prepared to respond next time should there be another Ebola crisis.",,,,,,,,,,,,,,,,,,,,,,,,,,,,,,,,,,,,,,,,,,,,,,,,,,,,,,,,,,,,,,,,,,,,,,,,,,,,,,,,,,,,,,
n15,Victoria I. Roberts,Victoria,I,Roberts,Jennifer Dohrn,16-Aug-19,Monrovia,Liberia,"Registered Nurse, Redemption Hospital, Communicable Disease Unit","Victoria Roberts is a registered nurse in the Communicable Disease Unit of Redemption Hospital in Monrovia Liberia. During the Ebola epidemic, Roberts served in an Ebola treatment unit as a frontline nurse.",Q: When did you first hear the words “Ebola Viral Disease”? Can you remember the first time as a nurse that you heard that there was a disease called this?,"VIR: My first time hearing about Ebola disease was in 2014. I heard of Ebola from Lofa, and that it was coming to the city of Monrovia. I had one of my nurses that worked at the emergency room come to Redemption Hospital, but we didn’t know that it was Ebola, and she contracted the virus. It began to spread within the whole hospital. A lot of people contracted the virus in the beginning, even a doctor, a foreign doctor from Uganda. He contracted the virus and he died. When we learned that it was Ebola, everybody began to take precautions.","By the time WHO [World Health Organization] came, there were a lot of people with Ebola. There was an outbreak in the city of Monrovia, and they decided to call us for a meeting. They told us that this virus can kill and how this virus operates within animals and within human beings. They began to lecture us and brought equipment for us to work with and people to train us. We saw that our people were dying. As mothers, we felt that all the children in the ward were our children, and we felt that the entire ward was our family. We saw that when it can go to another family, it can transfer to our family. So, we decided to rise up. We began to come together, to be united as women, and nurses, and we gave ourselves to WHO to train us to fight Ebola.",,,,Q: Can you describe what it was like to go into an Ebola Treatment Unit?,"VIR: We felt we were going in for a mission. So, the doctor, the whole team would go in as a team, and we would dress as a team. We put a mirror on the wall, always hanging. We made sure to dress with someone monitoring us to make sure there were no openings in our PPE [Personal Protective Equipment]. Everything had to be sealed up. Then we would look at ourselves in the mirror, and would make sure that we dressed properly. Before we went in, we would hold each and every one of our hands and give ourselves to God. We prayed as a team. We prayed as a team before going in.",,,,,,Q: Who was on the team going into the ETU?,"VIR: The nurse, the PA, the lab technician, and the hygienist. We would give them the IV. We would open the IV lines, each and every one of them. We would get [them] the medicine through their veins. We knew if we didn’t do it, they would die. The doctor was doing the assessment, the nurses were opening the IV lines, and the janitors were spraying on the ground. We were all making the best of things for the patients, trying to make them comfortable. When the nurses finished dosing, the patients were very weak, because the virus made them very weak. The virus made them tired, made them helpless. They were not even able to pick up a bottle of water to drink. But when you did your best to reach that patient, make sure that you fed them, make sure you got them even one bottle of water, it would ease their suffering.","We try to make them feel that they can make it, give them hope that they’re able to wake up again. We can only stay in our PPE for fifteen to twenty minutes, and that fifteen to twenty minutes, we are losing electrolytes. We are sweating profusely within the PPE. But we stayed because we wanted Ebola to stop within our country.",,Q: How did your family deal with the crisis and your work?,"VIR: When Ebola came, my husband was a hypertension patient, and everywhere within Monrovia the hospitals didn’t want to take anybody. They said it was Ebola. And because of Ebola, my husband began to worry, because he’s a hypertensive patient, and worrying will increase the hypertension. He needed O2, oxygen. He went to  another hospital. They didn’t want to take us. We went to  another hospital. No one want[ed] to take us. They said it was Ebola. I said, “No, it is not Ebola. If it’s Ebola, this is my ID card. I’m a nurse! I would have died, or I would have contracted the virus, but this is hypertension. Help me!” They were nowhere to help. When we got to Mawah in Vai Town, there was a clinic that I knew. But it was too late. ","So I was grieving when Ebola started, the outbreak getting rampant within Monrovia. I said to myself, even though my husband died, I must go into the ETU to work. So I must leave my children, my four children. The youngest one was six, the next one was eight, next one was twelve, and the oldest was eighteen. They began to obey me when I started doing my Ebola work. When I would come home later, I would tell them to put my water on the stove to get hot, and leave it on the porch, in the corner. Then, bring my clothes outside that I would wear when I came home. ","When I would come home, when they heard my voice, no one was allowed to run to me. Nobody could run to me to embrace me. No. They would remain in the house until I knocked and said, “Open the door.” When I would come home from work I would take my water off the fire and go in the back of the house, take a good bath, wash my uniform with chlorine and hang it up. Then I would knock on the door. Then they would open the door. As a mother, I go in but I wouldn’t sit close to them. If they wanted anything, I would tell them, “Go and get it in the house.” My children understood what was going on.",,,,,"Q: If you were asked to tell another country facing an epidemic, to tell the Ministry of Health an epidemic’s coming, what would be the parts that you would tell them to make sure to do for the nurses?","VIR: We need to encourage the nurses, motivate the nurses, see that their needs are met, because the nurses make something happen when they gather together. Because when there is no doctor, there’s a nurse there that represents the doctor. And when the doctor comes, the nurse informs the doctor.",,,,,,,,,,,,,,,,,,,,,,,,,,,,,,,,,,,,,,,,,,,,,,,,,,,,,,,,,,,,,,,,,,,,,,,,,,,,,,,,,
n16,Gloria Stevens,Gloria,,Stevens,Susan Michaels-Strasser,15-Aug-19,Monrovia,Liberia,"President, Liberian Nurses Association","Gloria Steven is the President of the Liberian Nurses Association. During the Ebola epidemic, Severs and her team provided training and supplies to frontline nurses.",Q: What you were doing during the Ebola outbreak?,"GS: I’m the president for the Liberian Nurses Association. During the Ebola crisis, we did training, did a lot of training for the nurses and for people in the community, teaching how do to handwashing, how to prepare handwashing fluid. We also did some triage training, in one of the counties, to help us to create a triaging unit. ",,,,,Q: What did you learn through this crisis?,"GS: If we had just sat down and we had done nothing, we wouldn’t have gotten anywhere. The community was complaining, “We don’t have this. We don’t have PPE [personal protective equipment]. We don’t have gloves.” You can’t tell somebody to “Wash these decks,” for instance, and you don’t give the person soap, you don’t give the person water. How will they wash it? So. We are the ones who try to fend for these people, who are actually in the field doing the work. If things are provided, people can be able to carry out the work.  We were nursing leaders, nursing advocates.","Those are our responsibilities. But funding is a problem. We have no real source of funding from anywhere, besides what nurses pay for their membership.  Whatever they pay for the membership card is our only source of funding, no other source, nobody else helping us with anything. We got to run this place with just that.",,,,,Q: What are you most proud of?,"GS: Well—what makes me proud is we have chosen a profession, a profession where we save lives. When you have a patient who comes in very sick and you treat that patient and that patient can come through and walk out of the hospital, it’s a source of pride for you, that you have done something for that patient to recover. ",,,"Q: Today now, in 2019, have you seen a change in how the health system supports nurses? Is there a change that you see? Has nursing changed?","GS: There should be shared standards for public and private facilities. Some of the private areas don’t want to send their staff for the trainings. The training will be there but they won’t send them.  If we have trainings for everybody, it should be standard. It shouldn’t be something that, because it’s public, then it’s one and, because it’s private, it’s something else. The government needs to think on how they can standardize salaries as well. If you have a BSc degree in nursing—everybody who obtains that BSc should get that same kind of salary.","Nursing practices and precautions need to be standard as well.  During Ebola, we had an IPC [infection protection and control] focal person in certain areas. Let that be a standard, so that people can continue to do it, even without the crisis, so that, when another crisis comes, you’ll already be prepared. Community engagement also needs to continue. The community is where people come from, before they come to the hospital. If you have things that were put into place during the crisis, they should continue to have them in place in preparation. Like handwashing. ",,,,,,,,,,,,,,,,,,,,,,,,,,,,,,,,,,,,,,,,,,,,,,,,,,,,,,,,,,,,,,,,,,,,,,,,,,,,,,,,,,,,,,,,
n17,Helena K. Tarnue,Helena,K,Tarnue,Jennifer Dohrn,15-Aug-19,Monrovia,Liberia,"Registered Nurse, ELWA Hospital","Helena Tarnue is a registered nurse at ELWA Hospital in Monrovia, Liberia. In 2018, Tarnue was one of five graduates in the first class of ophthalmic nurses to complete a year of intensive study at the New Sight Eye Center in Paynesville, Liberia. At ELWA, Tarnue was one of the first nurses to treat an Ebola patient in Liberia.",Q: How did you decide to become a nurse?,"HKT: Well, I decided to become a nurse to help my people, to help my country, Liberia. I started first as a nurse’s aide. I worked as a nursing aide for many years because there was no money for me to go to school. But then later, I started working at ELWA Hospital as a nurse’s aide, and then later on, I was offered a scholarship to go to nursing school, so I graduated and became a nurse.",,,,,Q: When did you actually see your first Ebola patient?,HKT: The first patient I saw was referred from Sierra Leone to our hospital. It was my first time seeing an Ebola patient. I was part of the first group that was trained to enter the Ebola Treatment Unit.,,,,,,Q: Can you walk me through what it was like working in the unit? Tell me what you did.,"HKT: When we went in, we would stay over an hour. We had to serve medication, feed the patients, and sit and look at them before coming out. Some of them were very weak and not able to feed themselves. We would clean them, take good care of them, change them, feed them, give them their medication, and then come out. I was the head for my shift.",,,Q: What was the process when you came out?,"HKT: The hygienist would spray you with chlorine water before you could take off the clothes. Then, you started taking off what you had on bit by bit, step by step. You take off the apron. You put it down. You took off the first—we all have three pairs of gloves. It’s not just one pair. Then you take off the apron. They spray you again. You had to be careful taking off the PPE not to touch the ordinary scrub guys. You have to be very careful. ","In serving medication, you have to be very careful, because of the needle, not to prick yourself, because some of the patients were combative. The patients might not want to take the medication because they are so down-hearted. You have to take your time, talk to them. Even if you’re giving them the food, they didn’t want to drink or to eat their food. So we would talk to them, encourage them, give them their medication. You can’t just take the medication and leave it. ",,,,,,Q: What happened when someone died?,"HKT: It broke my heart. Because can you imagine? One time, when I entered the unit, a boy had his phone and his mother was calling him. He was lying on the bed, so helpless and weak. I saw that his mother was calling his phone, so I took the phone with my gloves to put it to his ear so he could listen to his mother. But then after five minutes, he passed out. Can you imagine? The mother called back. I had to tell her that her son had just died. It was not easy in there. It was terrible. I had close family that died in that Ebola unit.",,,,Q: Tell me about your family—what did they think of you working in this treatment unit?,"HKT: I told my husband, my mother, and my father, and they said “No. You’re not able to work in the Ebola unit.” They said it was dangerous to go in the unit. I said “well, I have to go there to work, because I’m not worried that you people will catch Ebola, but if any of my extended family catches Ebola, how will I help them if I’m not there?” I tried to educate them. I said “you won’t catch it, but I’m there to help other people that are in need of me, so let me risk my life to help my Liberian people.” I was there to encourage them. I encouraged my husband. I said, I’m a health worker. I took an oath, so I need to serve my people. I said the MSF [Doctors Without Borders] is calling me for my interview. Please allow me to do it. At last, they agreed to the MSF interview, and I passed, and I started working in the unit.",,,,,,"Q: Once Ebola was ending, what happened next with healthcare at your hospital?","HKT: As ELWA Hospital personnel, we are still doing it. Wash your hands. We take your temperature before you enter. We ask you a lot of questions. Do you have fever? Yes. How many days? You show us. We mark it. We do your temperature flash. We monitor the temperature, whether it’s very high. Are you bleeding? No. Are you breathing fast? No. Do you have diarrhea? We ask all these questions at ELWA. The process is still going on at ELWA hospital.",,,Q: Those are lessons that helped change how healthcare is given.,"HKT: The healthcare system has improved greatly, because we are experienced from Ebola. But people are quick to forget. You know that most people right now, if they come to the hospital, and you tell them to wash their hands, they have a problem with it. They don’t want to wash their hands. We have to keep the health system going. We have to continue the hand-hygiene because it’s for our own good health to wash our hands. It’s important. Keep your hands clean. But some people have a problem with it. They already have forgotten what Ebola did, you see? We still have to keep the health system going. We have to still encourage them for hand-hygiene. It’s very important.",,,,,,,,,,,,,,,,,,,,,,,,,,,,,,,,,,,,,,,,,,,,,,,,,,,,,,,,,,,,,,,,,
